,Customer Name,Date,Ratings,Review Title,Reviews
0,Unknown ,11 August 2019,5.0 out of 5 stars,Dream come true product,It's a dream come true product. I bought it as deal of the day and functions are amazing. Easy to use. I have even used their semi auto washing machine. Thanx amazon for selling it
1,Viraj Patel,3 January 2021,5.0 out of 5 stars,Superb OTG with Premium Quality,"Superb looks, functions really well. I am an experienced baker, I tend to use my OTGs heavily, almost daily! This one is performing as expected. Little bit pricy but worth it, Gives posh look in your kitchen.Widebody, let's me cook delicious Cast iron pizzas in it. I can bake a lot of stuff at a time. Must buy!"
2,Amazon Customer,21 July 2019,5.0 out of 5 stars,Excellent Product,Product meets our expectation. It's easy to use and performance is excellent
3,Devanu,7 February 2021,5.0 out of 5 stars,Really happy with the purchase,"We were apprehensive about buying an air fryer, having spent the last three decades frying fish in a kadhai with abundant cooking oil. However, purchasing an air fryer has been quite an epiphany. It's really easy to use and the fried fish came out really well and flavorful. The end product was in some ways even better than the output with cooking gas. We are really happy with this purchase."
4,Mihir Patil,20 August 2020,4.0 out of 5 stars,Good product at a great price,"My friend has this Inalsa air fryer since over a year and considering he was very happy with the purchase, I bought this air fryer too at a price of 4377 (plus additional 10% sbi discount). It got delivered in a day. To my utter disappointment, the air fryer stopped working on the first day itself. It was simply dead. I ordered replacement and the replacement air fryer came in another 24 hours. I was kinda sceptical at this point and tried the air fryer, immediately after it arrived. To my surprise, it had few minor scratches here and there but I paid least attention towards them and tried using the air fryer. It worked! I am writing this review after around 2-3 months of usage and can say that it is working quite nicely. Have made many dishes and the experience has been good. It's not very good when it comes to deep fried items like Pakora or Samosas but it definitely is a good replacement for normal shallow frying and grilling. Overall, I am quite satisfied with the purchase."
5,Shashikant Yeole,18 August 2020,5.0 out of 5 stars,Better than expected,"Excellent way for cooking for veg and Non-veg families. What a perfect nonveg chicken tikka prepared, better than eating outside in hotel, fish fry perfect. Also tried french fries, veg cheese balls, all cooked so well. Remains hot from inside for much longer time than we do fry on pan or even in tandoor. So happy to buy and eat food cooked in this air fryer.Cons: The lock for frying pan gets stuck, manufacturer Inalsa must think of this point to avoid annoyance of the user.Also they should try to use electronic timer instead of mechanical one for these product if not done already."
6,Amazon Customer,28 July 2019,1.0 out of 5 stars,Poor design and Quality. Look for something Better.,"An impulse purchase based on Inalsa Brand name but I am disappointed. Product got delivered on evening of 27July 2019 yesterday and opened this morning 28th. Tried cooking french fries and the product worked flawlessly for the first 10 mins. As after 10 mins, I had to shake the fries, it stopped working and took lots of adjustment which was a mood spoiler. The next lot i.e. third time it stopped working at all and it's all due to poor mechanism.To summarise:- Product is easy to use and clean provided it's in use.-If it works well, don't expect it to be a lasting product as build quality is filmsy.- The unlock mechanism of fryer is faulty and can lead to unlocking of fryer from base and base will fall down too while removing contents.Based on the above retuning my product and will look for something better."
7,Rajesh Kumar Dhunna,30 January 2021,5.0 out of 5 stars,Digital ease and 4l size,Excellent all rounder.. Worth every penny.. This 4l model with digital ease is far superior to philips model.. which is expensive as well.. Good size for the family of 4 and few guests.. Go for it..
8,MANISHA J.,14 April 2019,4.0 out of 5 stars,Value for money,"Nice thing. We are fond of eating French fries, potato cutlets, samosas and other stuff, it saves a great deal on oil.Best product for the price.Though it they could have arranged for a demo, it would have been the best.Demo person didn't come even after multiple mails and calls. He fixed a date too and even then didn't show up."
9,Nabeel Sultan,7 July 2019,1.0 out of 5 stars,Loose body. Top cover not closing tightly,Paint of the baking tray coming off.  If its paint then too much bad for health.Then rust developing and that too is ferric red color type rust.Don't know what happened when I used itfor the second time since delivery of the product.  But may be while delivery or manufacturing defect. Top cover not closing completely and due to this the power is turning off. Has to put heavy object over it to let it continue operation. Waiting for Amazon's approval for return or repair.Need to operate for too long to cook completely. The timer is only 30 minutes but one cycle of 30 minutes is enough only for streaming the food. For frying the food it takes more than 1 cycle of 30 minutes
10,Vigneshkumar j,22 July 2020,5.0 out of 5 stars,Product quality is good,"Product quality and packing is good. It's 10BK kind a small one so while booking please check the size carefully because this can cook for 2/3 person. Worth buying for small family. Working function is too simple. They includes wire rack, DIP tray, glove and manual. In that manual some cooking tips are provided."
11,UMRA WASEEM,9 October 2019,1.0 out of 5 stars,GOOD Product But Bad Services,"It was a faulty product. I complaint to their customer care no. And they told me that their technician will pay a visit in 48-72 hrs and see to it But to our disappointment noboby ever came ! I also complained here bt that to was of no use ! Atlast we have to take it to the service center in our city all by ourself and where they very irresponsibly and casually told us ki ""Han complain to aai thi"" and they didn't care in the first place so we had to leave the product there and got the fault fixed after some days ! Now it works fine and is easy to use.. Bt their negligence is just not something that is acceptable!"
12,Nehal Kidwai,13 September 2020,3.0 out of 5 stars,Don't Buy-nsensitive Customer Care..Hopeless Service Centre.Irresponsive Customer Care,After a couple of months of use--the on/off Switch has stopped workingThe Customer Care is not respondingThey finally responded and asked e at home between 1230 to 5 pm else bring the Productas the Service Centre works only between this petiod Monday to Sat
13,Sanjay Yadav,23 January 2021,5.0 out of 5 stars,Excellent product,"Its too early to write a review as i got this product 2 days back. I purchased this for baking purpose and I love its  convection mode. It bakes the cake evenly from all directions. The quality of material is good, the accessories like grill tray and baking pan are also of good quality. The door has double glass which prevents the outer door from heating. Overall its a super product this price level."
14,Ratneesh N.,7 August 2020,4.0 out of 5 stars,Bake pan missing as mentioned in the ad,"The equipment deserves five stars. I have deducted one star because the mentioned bake pan was missing when I opened the box. What's the use of oven without bake pan. Moreover, why would I spend extra 1000 rupees on the utensil which I should be getting for free along with the oven. Else, the oven's body was firm and stylish. One can go for it, if all the accessories are available, especially the baking pan."
15,Meher Krishna Raju B,16 June 2020,2.0 out of 5 stars,MADE IN CHINA,"I brought this after comparing other fryers displayed on Amazon. The reason I chose Inslsa, even though it was a bit costly than other models, is because it is shown as made in India among the queries section. This is MADE IN CHINA. I wish they are Frank enough to admit it, so that we can make a righteous choice."
16,Himanshu,31 October 2019,1.0 out of 5 stars,Doesn't work anymore Amazon is sell so cheap quality products,Its broken in 1-2 months very light use. The food pan in out automatic ON OFF switch is broken. Doesn't work anymore Amazon is sell so cheap quality products
17,Raj Yadav,15 January 2021,5.0 out of 5 stars,Nice product,"It has all the function which a decent OTG should have. Moreover, it adds beauty to your kitchen. I recommend to go for it without any hesitation, buying it won't disappoint you."
18,sharda devi,16 November 2020,4.0 out of 5 stars,Working fine!! Must go for bigger version,"It is a perfect OTG for beginners not much function just a simple timer button and it have bell that rings loudly I like that, temperature upto 300 degree is fine in 10 ltr version.What I want to suggest that go for a 20 ltr or 16 ltr version because even if you are two member family anything less than 16 ltr will not serve the purpose I did a mistake and somehow I kept this.Overall it's a good OTG for beginners"
19,TK,17 October 2020,4.0 out of 5 stars,(Almost) the perfect airfryer,"I'm reviewing this 3 months after my purchase. I use this every weekend. 90% of usage is to make frozen items like chicken popcorn, nuggets, shami kebabs, and frozen samosas.. The device does a great job of cooking these.. The timer and temperature dials are easy to use.  The only problem I've had with the device is that the pan has started to erode in 2 months of light use.. I use a soft sponge to clean it, so that the coating doesn't come off, but in certain parts of the pan rhe coating has come off, which means sometimes food sticks while being cooked"
20,Amazon Customer,13 April 2021,5.0 out of 5 stars,A Very Good Air Fryer,Wanted to buy a good and Affordable Air Fryer for a long time. Finally found the one from Inalsa.Fitted my requirement for 4-5 family members (4L) and perfect price.It was delivered in time by Amazon and in good condition.This Fryer has been a fantastic addition to my kitchen with Low Oil cooking and guilt free eating.The cooking times are excellent and the cleaning is pretty easy with the inner tray removed for cleaning.There are no more oil spillages in the kitchen due to which the kitchen also stays clean.I know for a fact that this appliance is good to be long time cooking partner of mine.Thank You Inalsa.
21,Vidhya,19 February 2021,5.0 out of 5 stars,Awesome buy 👍👌,The best product ever. Perfect in size and awesome quality. Must buy OTG.Trendy design and easy to use. Comes with a instruction manual and recipe book.
22,MOHD,14 March 2021,5.0 out of 5 stars,Superb Technology,Never think the numbers of use before buying this price of technology...
23,sri,23 October 2020,5.0 out of 5 stars,A must product for every kitchen,"Must item for who loves fried foodAs I love pakora and chicken fry and who can't eat without fryums, I found this very useful and can eat guilt free.Love the crispy texture of foodI doubtedly bought this bcoz there are other high priced fryers in market but now feeling happy that I bought thisVery efficient at low price 👍"
24,Sanjukta Mishra,11 August 2020,2.0 out of 5 stars,So my suggestion for others to speak to the seller thoroughly before buying,I had complain about the seller. After I purchased the product the seller lowered the price. I felt cheated.The product is not Indian made as replied by some seller . It is Chinese made . So I am very disappointed. Working wise it is very slow. So overall I am not satisfied.
25,Ria Bhadani,27 November 2019,1.0 out of 5 stars,Worst service. Poor quality product.,"The product had a manufacturing defect due to which there was no heating. From past 8 mobths, I have only been chasing the customer support executive, while the product sits useless on my kitchen shelf. I would never recommend anyone to buy this product."
26,A,7 July 2019,1.0 out of 5 stars,Worst experience,Received a defective product... The customer service of inalsa is very poor.... Registered a complaint at inalsa customer service... There was no response.... I have returned the product...
27,pragya bhargava,21 September 2020,4.0 out of 5 stars,Perfect for a small family of 2-3 people as the size is small,I got this OTG after going through soo many other OTGs online and I must say that this a perfect OTG for a small family for 2-3 people. The size is pretty small so do consider that. I managed to cook a medium size pizza. But quality and the heating is good. If you have a small family then you can definitely go for this one. Other than the size I loved the product😍
28,Deepashri Karandikar,16 September 2020,5.0 out of 5 stars,Just what I wanted,"Though slightly smaller than my expectations, this OTG has given me wonderful results so far. I have made cakes, paneer tikkas and pizzas so far, and all were really well done. The pizza base turned out so good, I dont think i will every buy ready-made bases henceforth."
29,Purnima,29 January 2021,5.0 out of 5 stars,Happy purchase," I must say after much analysis of brands with Inalsa air frier I am happy with this purchase. It's really nice, easy to handle, can cook from a papad to soya chaap. Healthy way of cooking over Microwave and deep frying."
30,khalid parvez,6 October 2020,4.0 out of 5 stars,Sturdy but utility product,Useful and but bucket size is small for family of 4For second serving you have to wait for 20 minutesCooks well with a spoon of oilYou have to flip the product to other side and go for second round to get a fully cooked stuffBucket remain super hot take all precautions while using it
31,Pardeep Kumar,20 October 2019,5.0 out of 5 stars,Good but upper models are better,It is good product if you're only vegetarian... i thought i can barbecue the chicken in it bit it doesn't have option for that... but upper models have that.. so i would recommend upper models it is one time purchase so be sure for everything...
32,Anish Sharma,3 October 2019,4.0 out of 5 stars,"Too small,otherwise a good product",Purchased this item as a gift for my 10 years old daughter as she is interested in exploring her bakery skills however it's too small. Can't seem to find baking tools for this size. I grilled some veggies and chicken. Worked great.
33,Sanjay Sharma,28 January 2020,5.0 out of 5 stars,Fantastic product at most competitive price (Gadar),Fantastic product at most reasonable price. Instant hit in my kitchen and family. Does toughest jobs very easily. I can utilize my time for other important jobs while the Inalsa air fryer is doing my cooking jobs.
34,sudeshna,16 August 2020,4.0 out of 5 stars,Healthy option to cook and great value.,Its been a couple of weeks I am using it. Going great so far. Cooks really well with hardly any oil. Very healthy and tasty.Quality of plastic can be a tad better but ofcourse I got what I paid for.
35,shyam prasad sv,31 October 2020,1.0 out of 5 stars,Defective item,"Received defective product. Not able to return as Amazon doesnot have the return policy. They have only replacement. In the name of discounts, Amazon and their team is clearing off the defective items. Not reliable amazon india. ALSO DO NOT BELIEVE THEIR NO COST EMI PLANS. DO NOT FALL PREY TO AMAZON INDIA.THEAE LURING PLANS ARE ONLY BENEFITTING AMAZON INDIA. BANKS ARE ALSO SUPPORTING THIS MENACE."
36,Abdul Nazir,21 March 2021,1.0 out of 5 stars,Replace my air fryer please,"I am from Port Blair, Andaman and Nicobar Islands. On 11th feb 2021 i received one INALSA air fryer during my trip to Chennai. I used the air fryer only once but noticed that its body is getting very hot and from the next day it stopped working. Is there any possibility to replace it now?"
37,Ridhi B.,29 December 2020,1.0 out of 5 stars,Incomplete product,No user manual or booklet provided with the product ! How am I supposed to know how to it works??
38,Debleena,13 April 2021,5.0 out of 5 stars,Must have gadget for healthy kitchen.,"The product is an extremely useful gadget for a healthy kitchen. It is compact and doesn't take too much of kitchen space. There is no noise and it's easy to maintain. Oil usage is reduced to a minimum. We roasted chicken tikka and then fried fish, the outcome was as good as conventional methods but healthier. Very happy with product."
39,Harjot Singh,24 January 2021,5.0 out of 5 stars,Awesome OTG,Its perfect ..i could not have got any better otgit works perfectly fine and is very user friendly
40,Imran Ahmed,24 August 2019,1.0 out of 5 stars,Pleas ignore this item,"Body finishing is below par , tempreture control wheel is so ugly. At first sight it looks a like an unbranded assembled price.Works only for 5 minutes after that totally dead. Waste my time and my chiken also"
41,gautam chaini,7 November 2020,5.0 out of 5 stars,It is so GREAT..Just Go for it,It is really easy to use.. first time I tried Tandoori chicken and it was so yummy. Unlike tawa or oven it was juicy from inside and right texture from outside. My wife is so haapy with the product that she will order one more for her mother. Thank u Inalsa
42,Shabih Kazmi,24 October 2020,4.0 out of 5 stars,Satisfied,"I am totally satisfied with the product. Cooks well, very less oil consumption, will take some time to develop a taste for its food."
43,Kavitha ravi,11 February 2021,5.0 out of 5 stars,Amazing,My first airfryer and am totally happy with it. Tried vegetables and chicken. Awesome result. Yet to explore fully.
44,Abha,6 March 2021,5.0 out of 5 stars,"Convenient, healthy, low-maintenance","Inalsa air fryer is very convenient to use, saves up a lot of oil & keeps us healthy & light. It is low maintenance & easy to clean. We fried french fries & they got ready in no time & we enjoyed our fries guilt-free!"
45,Vision,27 March 2021,5.0 out of 5 stars,Value for money,The product is easy to use with minimal oil requirements. I recommend it to all wanting to decrease their intake.
46,ripy,21 August 2020,3.0 out of 5 stars,poor quality product,Had to return the product the next day because of poor quality of the locking system. the locking system became serviceable after a few operations on the first day itself. The fryer is useless without the locking system.
47,Amazon Customer,12 September 2020,3.0 out of 5 stars,Poor built quality,Built quality very poor. Handle not working within 15 days. Plastic smell in early use. Extremely difficult to clean food basket (food stick to basket holes)
48,guest,6 November 2020,5.0 out of 5 stars,Nice and does the job,"Nice product at a cheap price. Quality is decent for the price. Has temperature  control and timer, both functions well. Small oven for single person use. Only drawback is no light inside and a little difficult to clean after use. I got it at 2050."
49,deepak kulkarni,25 January 2021,5.0 out of 5 stars,Superlative product.. great pricing,Absolutely flawless.. very simple to operate.. easy to clean... very flexible to use... very aptly pricing too
50,PIYALI Bhujbal,10 August 2020,5.0 out of 5 stars,Happy customers,It's a best buy I hv done in amazon.10l is sufficient for family of four.its easy to clean.ehile the hand glove is not very good but serve the purpose
51,Amazon Customer,25 January 2021,3.0 out of 5 stars,Scratch and dent,Received the product today with scratches on baking tray and a dent on back side of the body. I haven’t checked the oven for it’s working condition but this was the initial findings
52,Randeep ,10 December 2020,4.0 out of 5 stars,Ok ok product,"I have got a bit defective product, wherein coating at handle got chipped after some time"
53,Amazon Customer,2 August 2020,1.0 out of 5 stars,Quality of product is as cheap as its price,Since the cost is less you might be tempted to go for this but it does not air fry the items deep inside only on the above surface. Better go for phillips . Also it gives a smell of burning plastic when used.
54,Leon,23 January 2020,4.0 out of 5 stars,Seems to be good,I have just received the product and used it a couple of times. Serves the purpose. Will update later
55,Sanjay Sharma,19 July 2019,1.0 out of 5 stars,Bad Quality,I think I made a mistake buying this... Right side of the body is damaged as mentioned in one of the reviews also... Asked to replace... Don't know if the the replacement piece shall be ok or damaged... fingers crossed
56,Manik,7 March 2021,5.0 out of 5 stars,The best device for cooking oil free and tandoori food,Its a nice device for my kitchen. It has made cooking easier and oil free. It helps us maintain the health factor of food using bare minimum or no oil. It helps to cook a variety of dishes.
57,Pravesh Aggarwal,27 October 2020,4.0 out of 5 stars,Truly amazing product,Bought this product less than a month ago and tried it a couple of times.. I'm enjoying lot of frozen and other items which we are able to make absolutely non-sticky and non-oily. Fully recommend this product. It's so easy to use and it doesn't spoil the flavour of the items.
58,Mithu Kakoti,20 March 2021,5.0 out of 5 stars,Happy Customer,Really happy with the purchase. Its looks great and brings a feel good factor when u enter your kitchen. Functions are easy to use. Loves the rotisserie function. Thank u Inalsaand Amazon.
59,Jal,27 November 2020,5.0 out of 5 stars,Insala OTG,"Working well, have used it to make different things have No problem good very good."
60,PARMEET SINGH ARORA,31 January 2021,5.0 out of 5 stars,Excellent service,"Excellent service, did had few hic ups initially but there service is supperb and I'm quite impressed with the time lines and support."
61,NATURE TREASURE ( YOUTUBE CHANNEL),31 October 2020,4.0 out of 5 stars,Worth buying,Very nice product..easy to use..it make great cakes.. worth the price..I highly recommend this.
62,NAVDHA MITTAL,26 August 2020,4.0 out of 5 stars,Smart and Useful for oil free cooking,"Beautiful look with smart design. Easy to use. Useful for healthy cooking. Though it is a Spain product but Like other Most of the air fryers ,it is also made in china . Please start production in India."
63,Ajay,20 February 2021,5.0 out of 5 stars,Very Useful,"Excellent product, value for money"
64,J,26 October 2020,4.0 out of 5 stars,Fryer review,Thanks Inalsa for helping us with this new Air Fryer to help us live a more healthier lifestyle by reducing the oil content from our daily food.. Product seems to be quite good with simple to use operations.
65,Luthra,22 March 2021,5.0 out of 5 stars,Excellent product.,Easy to use and best.
66,Amazon Customer Sandeep ,18 January 2021,5.0 out of 5 stars,Great product and an Amazing price.,Really enjoyed using it and enjoyed more eating what I cooked.  Really happy. Wish I had ordered it earlier. Just go through the instructions and you will realise that it is so simple to use.
67,MS,16 August 2020,5.0 out of 5 stars,Does its work efficiently..,I am happy with my purchase. Excellent product in this price range. Thanks Inalsa..
68,Kaveri chandra,14 September 2020,1.0 out of 5 stars,Damage product,"I am very disappointed this product is fully damage end to small size , ISO packaging is  damage , waste of money"
69,Amazon Customer,29 January 2021,5.0 out of 5 stars,Good size for family of 3 to 4 people,"Good product ,easy to use , air-dried paneer tikka, french fries ,vegetables ,satisfied with performance"
70,SHINE,11 November 2020,5.0 out of 5 stars,A boon for health conscious people,it is an awesome product. I love the dishes that come out of it .it's very crispy. much better than i expected. MY FAMILY CAN EAT HEALTHY FRIED FOOD !
71,Manish Kapoor,16 August 2020,1.0 out of 5 stars,Poor product and service by Amazon,Very badly handled by Amazon delivery. No warranty card. No bill. Seems that product is used. I decided to return immediately. Friends buy from local shop . Its better
72,KRISHNAKUMAR G,5 April 2021,5.0 out of 5 stars,Good and kitchen worthy.,"The product was superb. We made French fries, carrot sticks and Cauliflower fries. It was very good.Very easy to use. The bell was the highlight since it reminds us."
73,Dhaya,14 March 2021,4.0 out of 5 stars,Value for money air fryer,Value for money product. Easy to use with presets available in this product.
74,HR,3 August 2020,1.0 out of 5 stars,No heat no cooking,"Excitement lost AirFryer is not heating at all as required... Not even 10* heat wasted time, energy, money need replacement and assistance... If this company Product is not worth need money back."
75,SOURABH,1 November 2020,1.0 out of 5 stars,Bad,Very bad infact we r not cook cake in this
76,Hasib alam,12 August 2020,5.0 out of 5 stars,BUY BUY...,Worked perfectly well...liked it...hope so it will wrk fine in the future too...worth purchase 🧡
77,HIMANSHU,11 November 2020,1.0 out of 5 stars,Damaged product,"The product delivered is faulty, heating element turns on off frequently....useless. raised a replacement request but don't see any activity there.can someone take a look at it"
78,Zahoor A.,6 September 2020,1.0 out of 5 stars,I want to return,It is very small from my expectation I want to return it but the return window is closed .amazon plzzzz let me return this I didn't wanted this from u
79,Utkarsh Morarka,11 December 2020,5.0 out of 5 stars,Toaster Replacement,"Good and easy to use as a toaster substitute, especially in India where there are different types, shapes, & sizes of breads."
80,Amazon Customer,17 September 2020,2.0 out of 5 stars,Parts missing,Many parts are missing which comes with this device. Please contact.
81,Neha,28 December 2020,5.0 out of 5 stars,Must give,Make men in house cook. Teach them . One two three. .lol.. and wait for some creativity or mess in kitchen.
