,Customer Name,Date,Ratings,Review Title,Reviews
246,Poulomi Banerjee,3 December 2020,4.0 out of 5 stars,healthy option,i recommend this one . very nice to do grilled  and frying 👍
247,Shiny ,26 June 2020,1.0 out of 5 stars,Don't waste money on this waste item,Waste of money it's taking so long to get heat I suggest you to don't buy waste Product .m also returning it back
248,mausam,31 March 2019,5.0 out of 5 stars,Useful product,I jst loved it
249,Sunil sharma,13 September 2020,1.0 out of 5 stars,Product is out of order. Advice..,Item has got some problem n it's out of order since last week. Advice how to return it for repairing.
250,T,21 July 2020,5.0 out of 5 stars,No issues yet,"So far so good, has not given any problem it's been more than a week"
251,Rajesh Saxena,2 December 2020,4.0 out of 5 stars,Good,Good deel
252,Shivam Agrawal,11 August 2020,1.0 out of 5 stars,Product recieved is damaged .,"The product received is damaged , the top of the OTG has dent . Clearly not up to mark ."
253,Asif Shaikh,19 March 2021,2.0 out of 5 stars,Not working anymore,"Stopped working, we hardly add it for 10-15 times in last 8 months."
254,Vinod,8 April 2021,5.0 out of 5 stars,Reliable brand,A good product with ample frying space. Noise level is moderate too
255,karan p.,9 October 2019,4.0 out of 5 stars,Branded company..!,The product company is good and counted as one of the  branded company with respect to electronic appliances.
256,Venkat Chella,16 April 2021,4.0 out of 5 stars,Excellent Product,It's looking very nice product and easy to use. MORE good factor is safety.
257,Harsh Gupta,7 October 2020,5.0 out of 5 stars,Best air fryer,Perfect air fryer.Its a good.one and i really like it.
258,tapan m.,12 October 2020,5.0 out of 5 stars,Inalsa oven easy to use.,It is a easy to use and very durable and easy to clean.
259,Amazon Customer,13 October 2019,4.0 out of 5 stars,Missing things,I have not received crumb tray in it as written. invoice is also not provided. If any problem occurs before guarantee period then I should have it
260,Roopinder Mehta,5 October 2020,1.0 out of 5 stars,Not up to the mark,Not baking cake facing lots of problem...
261,rohin,5 August 2019,5.0 out of 5 stars,Good Product,Very good product...Loved the way it cooks...Would recommend it is some is looking for such product.
262,rajat r.,24 August 2020,5.0 out of 5 stars,Value for money,Best for small family
263,Rakesh,16 November 2020,5.0 out of 5 stars,Quality status,This product is good quality
264,Msing,18 December 2019,5.0 out of 5 stars,Value for money,Full paisa basil product
265,Dhakshayini A,22 August 2020,4.0 out of 5 stars,Happy 😊,It's really awesome 🤩 I appreciate!and highly recommend others to guy..
266,Vijay Puri,20 October 2019,5.0 out of 5 stars,Good product,"Excellent Fryer, very excited, easy to use, receipe book should have more items"
267,Harinder Singh,27 July 2019,4.0 out of 5 stars,Ok,"Had turned faulty within 10 days but got it repaired from inalsa, amazon should have intervened.."
268,Dr Sunil,21 February 2021,1.0 out of 5 stars,No food basket,This model of Inalsa doesn’t have food basket whereas all other models do have.
269,Certified User,23 January 2021,4.0 out of 5 stars,Nice product,It is a good product with good price. It do its job. Exceeded my expectations.
270,Rohit J,3 September 2020,5.0 out of 5 stars,Superb Performance,"Like - freedom from eating deep fried stuff, easy to use, handy & well guided instruction manual."
271,sonu garg,2 March 2019,5.0 out of 5 stars,Value for money,Nice product
272,Anuj,18 August 2020,1.0 out of 5 stars,Catches fire,It caught fire the first time I switched it on. Thankfully I got a refund.
273,Ajeet,24 July 2019,1.0 out of 5 stars,poor quality product,it gets broken very frequently.i have used it thrice only till date since buying it on 25th june.twice i had to take help of service engineer.ajeet
274,Sudha Kothary,26 November 2019,3.0 out of 5 stars,Good but very light weight,Very light weight with the result it is difficult to open & close without the entire oven shaking especially when hot.
275,Amazon Customer,9 November 2020,1.0 out of 5 stars,Not useful,Handle is broken and product takes long to fry or cook things.
276,Fathima,10 August 2020,1.0 out of 5 stars,Please don't,"Not safe for use,  some weird smell. Shivering etc...  return requested but no reply from amazon..."
277,Amazon Customer,24 October 2020,4.0 out of 5 stars,Stay healthy with Inalsa Air fryer,Using Air fryer first time. Very useful product from Inalsa for healthy cooking.
278,Jaishree,5 December 2020,5.0 out of 5 stars,Awesome product,Awesome product.can have guilt free dishes....easy to use.
279,Shakila,9 November 2020,3.0 out of 5 stars,No grill rotation,Its good....but u don't have full chicken grill rotater or grill rods
280,Amit puri,2 February 2020,5.0 out of 5 stars,Must buy!!,"It’s absolutely amazing to use this product, excellent condition, satisfying food with unbeatable taste, must buy this!!"
281,AKSHAT,23 March 2021,3.0 out of 5 stars,Nice product,Good
282,Aditya kapur,17 October 2020,4.0 out of 5 stars,Great quality,Good product. Value for money. Spacious product.
283,Seema madan,28 October 2020,5.0 out of 5 stars,"If you’re looking for a good product at a suitable price, go for it","Amazing easy to use air fryer, happy with service and quality"
284,Kirti Yagnik,6 September 2020,1.0 out of 5 stars,Not working,The product is not heating up at all. It appears defective and is not working at all
285,Amazon Customer,15 April 2021,5.0 out of 5 stars,Very nice,Easy to use and clean. Best brand I’ve used
286,Abhinav Gupta,30 March 2021,5.0 out of 5 stars,The product is a good value for money,It is having a good design.
287,Jitendrapuri,30 November 2020,4.0 out of 5 stars,Value,It take time to heat up
288,tarun,17 February 2020,4.0 out of 5 stars,Nice product.,"It is value for money, have been cooking frozen goods in this and they all come out great."
289,Sweta,4 March 2021,5.0 out of 5 stars,Best purchase,It’s just amazing product
290,gurpreet singh,28 January 2021,5.0 out of 5 stars,most important to know that how to use it properly.,we like your air fryer very much and we use mostly for french fries.
291,Ankur,19 September 2019,5.0 out of 5 stars,Its osum,"Easy to use, a very good product to use without the use of oil...100 prcnt recommended to everyone"
292,Sudhansu K.,2 November 2020,1.0 out of 5 stars,Not good product,It is very small size.not work properly.very bad experience
293,ankit jhamb,3 November 2020,5.0 out of 5 stars,Healthy lifestyle,Very easy to use and efficient to cook your food with less quantity of oil.
294,shiva kumar,12 September 2020,1.0 out of 5 stars,Damaged product,Received damaged one twice.. such a irresponsible response.. no value for customer
295,ashish sharma,26 August 2019,5.0 out of 5 stars,Best air fryer,Value for money... have used Phillips air fryer also... there is no difference apart from pricing...
296,Anmol Gupta,7 March 2021,5.0 out of 5 stars,Good enough for 2 people,Good quantity for 2-3 people. Easy to use
297,Amazon Customer,27 October 2020,5.0 out of 5 stars,Value for money.,"Nice product, value for money. Easy to use."
298,Anonymous Customer,13 July 2019,5.0 out of 5 stars,Nice product,Nice product. It is convenient to use and great product.
299,Dhruwat Bhagat,10 August 2020,1.0 out of 5 stars,Do not buy,Worst product to buy. Defective product received twice and pathetic customer service.
300,Stanley,13 February 2021,5.0 out of 5 stars,Just got the product!,"Just got the product,looks good."
301,Neetesh Sharma,7 August 2020,5.0 out of 5 stars,Money well spent,Best productBest in its classBest quality productBest price
302,Ajeet R.,15 April 2021,5.0 out of 5 stars,Nice product worth buying,Very good product value product easy to use nice
303,mohit,21 October 2019,5.0 out of 5 stars,"Very good ,value for money",Very Good product value for money. timely deliveryAnd demo done
304,Anurodh dixit,17 August 2020,5.0 out of 5 stars,Good product,Good and easy to use
305,Sachin Chawla,9 April 2021,5.0 out of 5 stars,Happy with the purchase...,"Great product, worth the price."
306,Prof. R.,6 March 2020,4.0 out of 5 stars,Good buy,Good
307,sukhvinder singh,31 July 2020,5.0 out of 5 stars,Very nice,Easy to use
308,Amazon Customer,9 August 2019,1.0 out of 5 stars,No guarantee card no invoice no recipe book,No guantee card no recipe book
309,Anshul Kumar,2 February 2020,5.0 out of 5 stars,A great buy!,A great product and a great buy. Already used it to make kebabs and potato patties. Came out nice and crispy.
310,Rasik,15 September 2019,5.0 out of 5 stars,Absolutely great!!!,Almost all air fryers are same. This has been an awesome one at such a price. Very easy to use and made excellent chiken for me.
311,Dishant Tirath,1 January 2021,4.0 out of 5 stars,Good product,Looks great. Easy to use and clean. Nice add-on of recipe book.
312,DALJEET SINGH,31 October 2020,5.0 out of 5 stars,Value for Money,Nice product with Great Quality. Also you can't beat the price.
313,Mouli Mehrotra,20 July 2020,5.0 out of 5 stars,Convenient,It's very convenient reasonable and easy to use.A must buy product seriously.
314,Ashu,15 August 2020,5.0 out of 5 stars,Air fryer,"Very easy and handy,keeps original flavour"
315,d kiran kumar,9 March 2021,5.0 out of 5 stars,Very nice product.,Nice product and good loking. Quality is good
316,Dhani Shani,4 January 2021,2.0 out of 5 stars,Not not good,Not not good
317,lokesh b.,1 February 2021,4.0 out of 5 stars,Nice product,Nice product ......saves your time and best for diet foods...
318,Aruna P.,16 November 2020,4.0 out of 5 stars,To know how to use proper way to get tasty food is important in,Likely Easy to use ..Unlike bcoz not get any user manual for
319,Eduru sampoorna,14 December 2020,5.0 out of 5 stars,Super product,Excellent
320,Sowjanya,7 November 2020,5.0 out of 5 stars,Very nice,Very use and very tasty and its cooking very fast
321,Amazon Customer,3 August 2020,1.0 out of 5 stars,Don't buy seriously,It literally stopped working in a month. What is this garbage product
322,Amazon Customer,6 November 2020,5.0 out of 5 stars,Its affordable..,The product is good...i can make crispy n juicy chicken.
323,Ramona,12 January 2021,5.0 out of 5 stars,👍 great,Awesome  product loved it .Delivery was quick
324,ASHISH,2 February 2020,5.0 out of 5 stars,Best in rate and quality,Best in class in quality and rate.food cooked is best
325,Anshul,27 January 2021,5.0 out of 5 stars,Awasom machine,Very nice product
326,Four Keys Creative Development P L,3 August 2020,4.0 out of 5 stars,Great Product,Super easy to use. Great product for anyone looking for an Air fryer
327,Naganand,10 September 2020,1.0 out of 5 stars,Chinese product,Poor Chinese product
328,Vivek dhar,5 April 2021,4.0 out of 5 stars,Worth buying for healthy you.,Awesome product
329,Ashok Sardana,10 August 2020,2.0 out of 5 stars,Drip tray is missing please provide.,Drip tray is missing in the package. Please provide.Thank you
330,Bishan Singh Chettri,24 November 2020,5.0 out of 5 stars,Nothing,Good
331,Sandeep,8 November 2020,3.0 out of 5 stars,Missing warranty card,I have not received warranty card with this.
332,Amazon Customer,7 April 2021,5.0 out of 5 stars,Excellent service by Inalsa,"Easy to use, value for money"
333,Prateeksha ghosh,14 December 2020,5.0 out of 5 stars,Fabulous,Did meet up to my expections......loved it ✌️✌️
334,Amazon Customer,1 October 2020,1.0 out of 5 stars,"Accessories, User Manual and Warranty card not delivered",Accessories and Instruction manual not delievered
335,navdeep singh,4 March 2021,5.0 out of 5 stars,Great product,Cooked fast with very minimal oil
336,Vikas,10 November 2020,4.0 out of 5 stars,Nice Product,Nice Product. Easy to use and clean
337,ankit tandon,30 September 2019,4.0 out of 5 stars,Good choice,Not used much. Just a test drive done..overall satisfied.
338,Teshhaa Gupta,31 May 2020,4.0 out of 5 stars,Good for bignner,Nice product
339,Sardar Ji,31 August 2019,1.0 out of 5 stars,Defected piece.,Item delivered is not in working condition. I have checked  late  after 10 days. Otherwise returned.
340,Shefali Chopra,17 October 2019,3.0 out of 5 stars,Ok,Price is less  but features r also less.Kindly compare twice with other options and then buy
341,Keshav bhartia,3 March 2020,5.0 out of 5 stars,Five star,Must buy product for kitchen
342,MULLA KHADER BASHA,18 October 2019,1.0 out of 5 stars,Waste of money don't bought nonlocal,Not worked Bad qualityWaste of money I don't like
343,Anil Rashima,4 October 2020,4.0 out of 5 stars,Over all good product,Heating takes little long
344,Rachna,9 December 2020,1.0 out of 5 stars,poor,poor quality
345,Suman Shukla,7 October 2019,5.0 out of 5 stars,Inalsa Air Fryer Light,Excellent product for oil free food preparation. We used it and enjoyedSuman Shukla 7987180714
346,Meggi,5 April 2021,1.0 out of 5 stars,Horrible,Damaged product
347,Indraneel Paul,21 February 2021,5.0 out of 5 stars,Easy to use and great product,Easy to use and clean. Great product.
348,Rudhar,13 November 2020,5.0 out of 5 stars,Helpful,It is sooooooo goood . complete value of money
349,manish,22 August 2020,4.0 out of 5 stars,Good,Size is small but as price it ok
350,Heena,24 October 2019,4.0 out of 5 stars,Inalsa otg review,"This otg is value for money, however there is no difference in grill and toast"
351,Sumit,31 August 2020,1.0 out of 5 stars,Bad product,Very bad product. Takes too much time to heat
352,Jagdish,1 November 2020,2.0 out of 5 stars,Ok product,It's ok product not mocha
353,Arc14,2 February 2021,5.0 out of 5 stars,Great product a must buy,A good buyEasy toh use
354,Amazon Customer,16 April 2019,5.0 out of 5 stars,Good Product !!  Value for money,Received in a decent packing and product is good value for money. Easy to use and cook items without oil.
355,yogesh,21 March 2019,1.0 out of 5 stars,.,Take too much time to fry. Even performance is not good. Not recommended for a family above two.
356,zuhaib,2 September 2020,5.0 out of 5 stars,Reviewing Inalsa Air Fryer,The product seems solid and long lasting
357,denny,9 March 2021,3.0 out of 5 stars,Good,The smell persists.
358,Rakesh Sharma,16 March 2021,5.0 out of 5 stars,Best Product,Easy to use
359,manisha,26 July 2020,1.0 out of 5 stars,Horrible product..doest work..Inalsa stuck,Upper and lower rod together is not heating up...
360,Sushant ,3 November 2020,5.0 out of 5 stars,Nice product,Nice product in reasonable price
361,Astha Sibbu,2 November 2020,5.0 out of 5 stars,V nice,Best for gifting purpose
362,Ravi Pandey,15 February 2020,5.0 out of 5 stars,Value for money,Excellent buy
363,shashank tyagi,7 April 2021,5.0 out of 5 stars,Best in line,Perfect
364,sumit Kumar,30 October 2020,4.0 out of 5 stars,Crum tray is missing.,Crum tray is missing in the box.
365,patel Ashok J,13 March 2020,1.0 out of 5 stars,Do not buy,Useless item .After one time replacement its not working
366,Amazon Customer,31 October 2020,4.0 out of 5 stars,Helpful,Helpful and easy to use
367,Preeti sawlani,29 October 2020,4.0 out of 5 stars,Good,Good and easy to use!!
368,Kazi Amid Bari,2 October 2019,1.0 out of 5 stars,Damaged food basket after 1st use,"Bad experience, Food basket teflon coating got removed after the 1st use."
369,Faizal shaikh,28 September 2020,4.0 out of 5 stars,Worth for the value,Nice for 2 people.
370,aditya,5 February 2021,5.0 out of 5 stars,nice,very good product
371,DK,6 November 2020,5.0 out of 5 stars,Excellent product,Excellent product
372,Rima mukherjee,29 August 2019,5.0 out of 5 stars,Nice value for money,Oilfree food..love it
373,Amazon Customer,13 November 2020,5.0 out of 5 stars,Best product,Awesome product
374,Sanjeev kumar jain,4 January 2021,5.0 out of 5 stars,How to operate.,Easy to operate.
375,Abhay,16 August 2020,4.0 out of 5 stars,Value of money,Awesome OTG
376,Narendra Agrawal,11 June 2020,5.0 out of 5 stars,Good product,"It's a very helpful product, when on diet😊"
377,Namrata,6 February 2021,4.0 out of 5 stars,Value for money,Value for money
378,Princess,26 October 2019,2.0 out of 5 stars,Its looking nice but i got defective product 😔,I got defective product that is why i am not satisfied with this
379,Bright MV,26 February 2021,5.0 out of 5 stars,Super product,Very nice 👍
380,Nilesh khebade,12 July 2020,5.0 out of 5 stars,Easy to use easy to cook,Very nice air fryer ever made.
381,omar,23 February 2020,5.0 out of 5 stars,Awesome,This product is awsome! Easy to use and value for money!
382,Vijay Bhasin,27 January 2021,5.0 out of 5 stars,nice product,Gud product
383,Deepa  harisinghani,18 February 2021,5.0 out of 5 stars,Nice,Nice product
384,Anil Kumar Verma,26 August 2020,1.0 out of 5 stars,Horrible product,Did not work properly even once
385,Amazon Customer,13 February 2020,5.0 out of 5 stars,Value for money,Easy touse
386,Aishwary,29 September 2020,1.0 out of 5 stars,Comes with dent,There was a big dent on it
387,Megh Rai,29 October 2020,4.0 out of 5 stars,Baking bread,Nice and easy to use .
388,Rashmi sharma,11 November 2020,4.0 out of 5 stars,Good buy!.,True to description.
389,vaibhav k ,20 August 2020,4.0 out of 5 stars,"Simple Dial , Easy to Use , Good Capacity",Would Recommend
390,Sunil Bure,25 July 2020,3.0 out of 5 stars,Excellent Product,Good product at low price.
391,Sachin Arora,28 January 2021,5.0 out of 5 stars,Excellent Product,Smart product
392,Ayush,9 July 2020,5.0 out of 5 stars,Worth a buy,Good product
393,Amazon Customer,12 November 2019,2.0 out of 5 stars,Not bad,Very light weight but model is good
394,Chhaya ,27 August 2019,1.0 out of 5 stars,Bad product,Defective product delever
395,Smriti,26 June 2019,1.0 out of 5 stars,Replace my product,The product is not working  icame to know today because engineer come today for demo
396,gurkaran Singh,25 June 2020,5.0 out of 5 stars,Perfect,Amazing fryer. Perfect at this price.
397,somya chauhan,7 October 2020,4.0 out of 5 stars,Good product,Good product
398,Amazon customer ,11 February 2021,5.0 out of 5 stars,Looks good,Looks good
399,Shankar store,14 August 2020,5.0 out of 5 stars,thumbs up,working nicely
400,r k p,18 August 2019,1.0 out of 5 stars,China Maal,After one use stop working. Really Chinese brand.
401,Fahad Shaikh,26 November 2020,1.0 out of 5 stars,Nothing,Pathetic
402,Sujatha,25 August 2020,5.0 out of 5 stars,So nice I enjoyed,Good product
403,Deepali  Sharma,21 December 2020,4.0 out of 5 stars,Very good,Nice product
404,U Mohammad,6 December 2020,5.0 out of 5 stars,Excellent,Supper
405,RAHUL GULATI,4 September 2020,5.0 out of 5 stars,Inalsa Air Fryer,Very good product.
406,Heena,1 November 2020,4.0 out of 5 stars,Easy to use,Very nice product.
407,vaasanthi,17 August 2020,4.0 out of 5 stars,Gud,Value for money good product
408,Divansh Koul,31 August 2020,5.0 out of 5 stars,Worth it,Best product for the range
409,Aditya Labroo,25 November 2019,5.0 out of 5 stars,Very good product!,"Reasonably priced, easy to use!"
410,Amir khan,25 August 2020,5.0 out of 5 stars,Halpfull,Nice product thanks amozon
411,Priya N.,1 August 2020,5.0 out of 5 stars,Must by,Nice product must buy
412,vijay kumar,6 December 2020,4.0 out of 5 stars,Good product,Good product
413,Shivang J.,4 December 2020,4.0 out of 5 stars,Good product,Good product
414,Amazon Customer,5 June 2020,1.0 out of 5 stars,Wrost,Electric Rod was working very wrost!
415,Anjali vora,18 November 2020,5.0 out of 5 stars,Easy too use,I just love it
416,rajesh dhall,27 June 2020,5.0 out of 5 stars,Good product,Good product. Easy to use
417,Choti,25 July 2020,1.0 out of 5 stars,Money waste,This is waste product
418,APOORVA AGARWAL,6 December 2020,5.0 out of 5 stars,Worthy product,Easy to use
419,Sourbh,26 September 2020,4.0 out of 5 stars,Value for Money...,Good Product
420,Ankita sinha,19 May 2020,5.0 out of 5 stars,Excellent product value for money,Excellent product
421,upasna,12 November 2019,1.0 out of 5 stars,Not good,Not a good product
422,Amazon Customer,10 November 2019,5.0 out of 5 stars,Kitchen friendly product,Easy to useKitchen friendly
423,vivek dabral,12 November 2019,5.0 out of 5 stars,BEST BUY,"easy to use product and value for money product,"
424,venugopalarao m.,17 October 2020,3.0 out of 5 stars,Good,Easy to use
425,SHOBHANA ,17 August 2020,1.0 out of 5 stars,Insala otg damaged,Product was damaged
426,Vishnu,29 November 2020,1.0 out of 5 stars,Waste,Waste
427,Achyut Singh,9 January 2021,5.0 out of 5 stars,Value for money,Nice
428,Saminder Kaur,4 October 2020,5.0 out of 5 stars,"Good product, easy to use",Good
429,Amazon Customer,21 August 2020,1.0 out of 5 stars,did not heat up,this did not work
430,Tanu,5 October 2019,5.0 out of 5 stars,Fantastic product!!!!,Awesome!!!
431,santosh kumar,4 April 2019,3.0 out of 5 stars,Nice product,Good product and easy use this
432,Akhil Bari,8 October 2019,1.0 out of 5 stars,Packing very bad,Packing
433,Jeedimalla Padma,25 September 2019,5.0 out of 5 stars,So nice product.,Nice .
434,Gopal ji,4 October 2019,5.0 out of 5 stars,Very well,Good
435,Switi ,7 June 2019,5.0 out of 5 stars,.,Easy to use
436,bhushan g.,5 March 2019,4.0 out of 5 stars,Ok,Ok
437,AJAY,24 December 2020,5.0 out of 5 stars,Amazing product by Inalsa,"We loved having this one in our kitchen, it looks so stylish. The look is classy. Coming to the functions, it has just everything needed for baking grilling roasting, including a convention fan and a chamber light as well. The accessories are just perfect. Best at this price!!"
438,AJAY,14 January 2021,5.0 out of 5 stars,Buy this one!!!,"Best appliance ever!! I use this product on average once a day, maybe more. And it cooks so efficiently. Be it chicken, fries, roast and all without the grease. It doesn't take too long to warm up various items either. The food comes out great. Gotta try it."
439,Tulsiram jagannath bhisikar,4 March 2021,5.0 out of 5 stars,Eat healthy live healthy,"HEALTHY EATING by cooking with 85% less oil for fat-free delicious meals. Same flavor and crispy finish without the added calories! Simply add food to the drawer pan, add a tbsp of oil if desired, set temp/time, and start cooking!FAST PREPARATION 360° air circulation technology and with 1400W of power this air fryer ensures that every inch of the meal is well heated thus crisped by rapid supper-heated air. Just put ingredients into the fryer basket, push a couple of buttons and wait for the meals to get prepared.PERFECTLY CRISPED results every time. This electric multi cooker system cooks food brown and crispy on the outside and keeps moisture inside without the excessive use of oil that has too much fat. Prepares great tasting crispy skins and perfect for making potato friesADJUSTABLE TIME/TEMP gives you the ultimate in cooking control and versatility allowing you to fry, bake, grill and roast all in one! A high-power convection fan envelopes food in temperatures from 40 to 200 degrees and a 30-minute timer automatically shuts off the air fryer at the end of the cooking cycle.ENOUGH FOR EVERYONE, the perfect appliance for picky eaters, large families, entertaining, or those with busy schedules With 4L make an abundance of appetizers, desserts, chicken wings, french fries, or even baked goods, and all within minutes of setting the timer - it couldn’t be easier !!"
440,Divya D.,8 March 2021,5.0 out of 5 stars,Overall good product.. compact.. aesthetically nice and does its work,"I recently bought this air fryer and so far for the initial month, the performance is very good. I tried seekh kabab, fries and smileys.. they were made as good as fried ones.. I liked the product.. the size of the product is also pretty small"
441,Hemangi ,21 August 2020,1.0 out of 5 stars,Big upsetting not worth it,Terrible pls don't ever order they have no value for people money and client satisfaction I received the product in damage condition no hand gloves the handle and tray in the machine completely dent I had cancel and asked for my refund
442,SUBHASH PATIL,6 March 2021,5.0 out of 5 stars,Awesome product,"Superb product as compare to any other Brand. Easy to use, nice performance. 101% satisfaction product. Got quick delivery, thanks to Amazon"
443,Amazon Customer,26 January 2019,4.0 out of 5 stars,User friendly,The product is user friendly and very easy to operate. The design and color of product is very impressive. Makes healthy and delicious food.
444,Mahender Singh Negi,8 March 2021,5.0 out of 5 stars,Awesome,"Awesome air fryer , good for airfrying good for roasting food for grilling and baking, I have used this nutri fryer about 18  or 20 times and till now"
445,chhavi,28 May 2019,5.0 out of 5 stars,Excellent product,Made paneer tikkas in inalsa air fryer and they turned out to be awesome. Absolutely loved the product. Highly recommend buying it. Plus inalsa offers home service of the product which is a huge benefit.
446,Manas Rajput,28 January 2021,5.0 out of 5 stars,Good product!,A good product. Super easy to use and cleanOne suggestion is to increase the temperature limit to atlest 300 c
447,Amit,27 October 2020,1.0 out of 5 stars,inalsa master chef 10 BK,Very small...not work properly...over heating...bad product ...not excepting ..inalsa service very poor...customer care not support..not answered properly ...very disappointed for this
448,Amazon Customer,20 March 2019,1.0 out of 5 stars,worst air fryer,got damaged within 1st use...cheap quality and plastic is also not good...give a burnt smell on cooking...go for havells or philips...this is aan honest review...plz dont waste your money people!
449,Amazon Customer,20 June 2019,1.0 out of 5 stars,Defective products are being sold by amazon.,1st time got defective product which was slightly damaged as default.Got it replaced after a month to which again got a more faulty piece.Now i dont have any option on what to do as i am not having replacemeny option now.
