,Customer Name,Date,Ratings,Review Title,Reviews
82,Amazon Customer,18 February 2021,4.0 out of 5 stars,Must have in your kitchen for all food lovers,"Looks stylish and good size. The basket is very good size. Perfect addition to your kitchen for healthy snacks at home. Make paneer tikka, chaap tikka or non- veg at home."
83,Susmitha,6 August 2020,4.0 out of 5 stars,Very nice product,"Easy to use, bakes even cakes well. But ideal for frying."
84,Dhruv,26 October 2020,5.0 out of 5 stars,Inalsa air fryer,Great product for health conscious people who wanted to have taste in food nd want to have good food. Received today and used today. Easy to use and very sturdy and strong product.
85,Preetham,16 September 2020,1.0 out of 5 stars,W,Such a waste product never seen don’t waste ur valuable time nd money  literally to cook pizza taking more than a hour
86,jyoti shah,11 November 2020,3.0 out of 5 stars,You could make the product better by making a change to the release lever.,The product is OK.It has a difficult handle and one tends to forget not to press the release lever while handling the hot food.
87,Pallabi,16 January 2021,5.0 out of 5 stars,Good product in reasonable price 👌,"Looks wise it is very good, capacity is also great,easy to use, easy to clean..Made some French fries which turned out to be very tasty let's see what happens in long term use."
88,Yash,9 August 2020,5.0 out of 5 stars,Excellent product.,"Quick delivery by Amazon. Got it at a great price. Excellent product, very easy to use. The box also contains a very thorough instruction manual and a cook book. Provides a wonderful cooking experience."
89,Pulo,28 October 2019,1.0 out of 5 stars,Not working,I want exchange product is not working
90,Amazon Customer,13 April 2021,1.0 out of 5 stars,Really Bad,Didn't return before 10th as till now the executive kept saying they would come for a demo but till now they haven't its really bad.Doesn't work at all
91,SANDEEP KUMAR PORWAL,13 January 2021,5.0 out of 5 stars,air fryer,good quality
92,Aruneel Kapoor,6 August 2020,5.0 out of 5 stars,Inalsa air fryer rocks,"Awesome product, stay healthy with cooking on this one.It's amazing product  at very decent price.I bought it at 4320 and trust me its totally worth it...loved this"
93,amit,9 August 2020,4.0 out of 5 stars,Awesome in budget,This seems to be very good air fryer within such budget range. Yesterday we prepared french fries it was just like a McDonald's. Really a very good airfire within such price Range
94,vivek ,5 September 2020,5.0 out of 5 stars,Excellent product. Value for money,"Product is very easy to use, easy to clean and food tastes perfect."
95,Deb,24 March 2021,5.0 out of 5 stars,value for money,"nice product with great value, tried few air less frying and quality is reallygood"
96,Nagpal A,6 December 2020,5.0 out of 5 stars,It’s easy to operate,It’s good as oil free products can be prepared
97,Amazon Customer,10 August 2020,3.0 out of 5 stars,Not satisfied,Release button got stuck inside on the fourth use itself . Handle quality is not satisfactory. Rest fryer works fine .
98,Raj,3 February 2021,4.0 out of 5 stars,Lead healthier life,Really happy to use this product to make french fries with very less oil
99,imran khan,17 August 2020,1.0 out of 5 stars,Damaged product received,The product received was damaged. The temperature control button was broken & not working.Returned the product. No replacement option was provided.
100,Nena,30 August 2020,5.0 out of 5 stars,Good,"Worth of money. Not that big but you can easily make pizzas, cakes and all.. Love this microwave. Very easy to use."
101,Malvika gupta,13 April 2021,4.0 out of 5 stars,Good buy!,Easy to use. Although very small portions cook at once while making fries. Happy with the product otherwise ☺️
102,Sudhansu Mohan Gaur,29 October 2020,5.0 out of 5 stars,easy to use,easy to use
103,Amazon Customer,24 March 2019,5.0 out of 5 stars,Great,Nice
104,aateek singh,24 March 2021,1.0 out of 5 stars,Untested product delivered,I got the product today and when we started to pre heat it's giving voice a big short circuit. Tried again and same result. How can I replace the item ?
105,Ghulam Sarwar,29 October 2020,5.0 out of 5 stars,It is a good product,It is very good and useful product. It quality is very good.
106,ishan mahajan,10 June 2020,4.0 out of 5 stars,Best airfryer,Got the air-fryer at a good price and it is very easy to use. Non veg and veg snacks lover it is a must buy to have a hygienic oil free food
107,Murali Krishna Badaballa,4 October 2020,5.0 out of 5 stars,Good Product,Good Product
108,Lulu,11 November 2020,4.0 out of 5 stars,Compact and easy to use,"A wonderful small oven that has multiple uses - baking, roasting, etc. Happy with it."
109,eshita gaur,13 February 2021,5.0 out of 5 stars,Great product,The product is easy to use .. user manual gives u ease of use you also get recipe book..various modesThankyou inalsa
110,Sam,11 March 2021,5.0 out of 5 stars,Excellent product,Very good product...... It's very easy to use and clean..... I highly recommend it
111,G S.,30 August 2019,1.0 out of 5 stars,Inalsa not reliable,Return window closed. Stopped working after using 3 times in two months of purchase. What will be my fate
112,Deepali,12 April 2021,5.0 out of 5 stars,Value for money,Its a good product and value for money
113,Bhupendra sharma,10 January 2021,1.0 out of 5 stars,Was not Working properly,Was not working properly
114,SC,14 February 2021,5.0 out of 5 stars,Good buy,Nice product. Easy to use. Very sturdy.
115,Navya,31 March 2021,4.0 out of 5 stars,"Product is good, Customer care service is bad.",The product is nice and easy to use. But the customer care service at Inalsa was terrible. It took them 14 days to send a technician home.
116,Madhava Kumar,7 April 2021,2.0 out of 5 stars,It stopped working suddenly,It is easy to use. but it stopped working suddenly after we used it for 3 to 4 timesso i felt like i wasted my money on this product
117,Amazon Customer,21 July 2019,3.0 out of 5 stars,Average,We purchased it as gift for someone.....yet delivery was fast....bt the product we received was cracked from one side....not much satisfactory results
118,Mani,22 August 2020,5.0 out of 5 stars,Excellent retailer and product,Good price and product is worth every penny
119,Lalitha,22 July 2020,5.0 out of 5 stars,Good,Although a little scratches.. Product is so good. Suitable for small family
120,Kanwar M.,3 September 2020,4.0 out of 5 stars,good,good
121,Hema,24 March 2021,4.0 out of 5 stars,Smart system,Liked the product
122,Maharshi,15 April 2021,4.0 out of 5 stars,Good product.,Tried with various frozen food items and works well with less oil usage.
123,Shubham Taksali,17 October 2019,5.0 out of 5 stars,Happy,Good quality product which can be used for various purposes. Happy to purchase it :)
124,Moin,30 July 2020,1.0 out of 5 stars,Worst otg ever seen,"Very bad 👎 👎 👎 burns everything ,and doing smoky kitchen . I want to replace my OTG andwant to perchase microvave . Don't worth stars"
125,Ravi k.,31 October 2020,4.0 out of 5 stars,Easy to handle,Easy to use. But if one follow the recipe from the booklet provided then be careful things can be burned.Till now found it good for frozen products.
126,Adney m.,23 July 2020,5.0 out of 5 stars,Amazing product,Very good product I have baked this chicken cocktail  rolls I'm happy with this  Amazon product very easy use value for money
127,Parul Saini,8 November 2020,5.0 out of 5 stars,Worth every penny,"Have used it to cook Smilies, French fries, Cheeze nuggets, and Paneer Tikka. All came out very well."
128,Happy,18 October 2020,4.0 out of 5 stars,Nice product,Nice product. Does the job well and fairly easy to operate.
129,Vaibhav singh,11 March 2021,2.0 out of 5 stars,Product box and inner thermacol is broken, This item packaging is broken and its Thermador is also broken in the box
130,Diwaker Tiwari,7 November 2020,4.0 out of 5 stars,Overall value for money,Good quality but it's too small 2/3 people use only
131,anie,8 February 2020,1.0 out of 5 stars,Not recommended,"After 1 month use , facing switch related issue . Got repaired once but the problem not resolved completely. Will not recommend this product and brand.. kindly arrange for replacement."
132,Khush,5 March 2021,4.0 out of 5 stars,Wonderful experience,Very nice product at this range. Happy to have this. Easy to use and comes with recipe book. Had a try as well. wonderful experience.
133,Sirimulla siddu,26 October 2020,4.0 out of 5 stars,Best product,True value
134,Joji Pallath,2 November 2020,2.0 out of 5 stars,Not suitable for family,10 L too small for family even you can't grill a whole chicken.......if you planning to buy grill buy at least 16 L or above
135,Rishi Rai,11 March 2019,4.0 out of 5 stars,Value for money,Best air fryer in this segment .excellent performance and value for money.
136,deepak,9 February 2021,1.0 out of 5 stars,Waste chinese product,It stop working in 6 months...dont buy this chinese product....sure you will disappointed
137,Fahad,25 October 2020,4.0 out of 5 stars,"Good product, light weight and easy to clean.",Seems to be nice. I made some readymade fries and cheese triangles. They were fine. Maybe with some practice I'll do better.
138,vipul taneja,2 August 2019,1.0 out of 5 stars,DONT BUY IT,I bought this product on 19th july and it stopped working abruptly after few days(the day I am writing this product the date is 2nd of august).Please go with a better brand like Prestige or Phillip's
139,Bharath Guduri,13 August 2020,2.0 out of 5 stars,Instruction Manual & Recipe Book,Doesn't the Air Fryer come with any Instruction Manual & Recipe Book? I just go the Air Fryer along with an Extended Warranty Coupon in a Cardboard Box Package!
140,Shrek,30 June 2020,1.0 out of 5 stars,Fraudulent and fragile productñ,It's made in China.. whereas it's written the manufacturer is Indian on product description.I have taken a screenshot of that
141,Himanshu,12 November 2020,1.0 out of 5 stars,Worst brand,"Inalsa is the worst brand to buy, the product stopped working just after one use."
142,Shalini Jain,9 August 2020,5.0 out of 5 stars,Very easy and convenient,Makes live easier as can be operated in the kitchen with fan switched on. The product is easy to use and saves lot of time. I feel it is totally worth its price
143,Mukesh bhatt,25 October 2020,5.0 out of 5 stars,Size is good n easy to clean.,Good looks.Easy to use.Easy to clean.Good size also.
144,Atul Patni,25 July 2020,4.0 out of 5 stars,Nice product,It is a nice purchase with easy to use functionality and value for money..A better recipe manual would have been great
145,Rohit M.,23 August 2020,4.0 out of 5 stars,Very good at this price point,The product is very versatile and doesn't require much oil. Very good at the price point but the plastic is a bit delicate and needs to be handled carefully.
146,Noel peter,1 April 2021,5.0 out of 5 stars,Life changing product,"Amazing product...must buy, if you are looking for healthy life-style change.superb design and comfortable to handle."
147,Priti sinha,13 September 2020,5.0 out of 5 stars,Very nice,Nice product 16L is perfect size
148,GURKIRAT SINGH PURI,29 March 2021,5.0 out of 5 stars,Value for Money,"Excellent product. Easy to use, easy to clean and provides original flavours"
149,Kamalpreet Singh,22 October 2020,5.0 out of 5 stars,Good service,Very very good variety
150,Atul Batra,16 April 2021,5.0 out of 5 stars,Fantastic product,Amazon: Great deliveryProduct: Does what exactly is described for- oil free frying. Tried for 2 days- looks good
151,Sumit Dubey,29 August 2020,4.0 out of 5 stars,A good purchase.,A good item. A must for people who want to try quick and easy recipe. Taste is also good. Price is also good.
152,Reema,28 October 2020,1.0 out of 5 stars,No warranty card no recipe book received,Didn't receive warranty card nor recipe book. Only received the air fryer. Seller should take care of all this before packing
153,ashutosh sharma,24 October 2020,5.0 out of 5 stars,Perfect replacement of deep/shallow frying,Lot's of space inside for cooking. Easy to use. Makes crispy food.
154,Satish Nayar,10 November 2020,5.0 out of 5 stars,Easy to handle & use,I used the product for preparing snacks.  The snacks got prepared without any mess or hassle & they were oil free.
155,Ankit Gupta,13 April 2021,5.0 out of 5 stars,Good prices clean product,Product was received with ease without any complications.Brand new product.
156,Amazon Customer,24 March 2021,4.0 out of 5 stars,Check one  in which temperature can be more than 200 degree Celsius,"I used this one for making french fries.it came out well, but was less moist compared to pan fried fries."
157,Sijimon Mathew,27 October 2020,5.0 out of 5 stars,Superb.................,It's finishing is very cute and it's a beautiful oven
158,saurabh,12 August 2020,5.0 out of 5 stars,Value for money,Easy to use. Look excellent
159,Shamu Meitei,13 February 2021,5.0 out of 5 stars,About this oven,"I used it for baking cake, bread and even making pizza and is doing perfectly. I like it"
160,mukesh chaudhary,14 February 2021,5.0 out of 5 stars,Loving it.,It is good product with reasonable price . It is best in market at this price.
161,PINTU PAJAI,2 July 2020,5.0 out of 5 stars,Excellent product.,Very useful and makes delicious chicken without oil. Temperature settings are good. Space is adequate and does the job perfectly.
162,saman,10 June 2020,1.0 out of 5 stars,Refund,Very poor performance and temperature issues were found hence returning the same
163,Sankar,3 February 2021,2.0 out of 5 stars,Ok,"Air fried chicken  tast not good and get smell of heater , quantity  also less the Description"
164,Kyrshanskhem Lyngdoh Marshilong,26 October 2020,5.0 out of 5 stars,Loved it!!,"Easy to use, my first cake came out perfect"
165,Amit Bakshi,15 September 2020,5.0 out of 5 stars,"Excellent, Go for it","Very good product, modern look, durable build quality and easy to clean."
166,Poonam Chaudhary,7 February 2021,5.0 out of 5 stars,Must for a healthy lifestyle,Great product to lead a healthier lifestyle. The product is easy to use and clean although I hoped it to be much more compact.
167,Siri,1 June 2020,1.0 out of 5 stars,Please change the product it's not working,It's not working please change the product I want another product we want tomorrow please change otherwise I take serious decision k
168,Amazon Customer,5 January 2021,5.0 out of 5 stars,Must buy if you want to cut oil,This is a must have product if you want to cut on oil. Very easy to use and clean. Taste of food after air frying is very good
169,Amazon Customer,15 April 2021,1.0 out of 5 stars,Waste,Dont waste your money by buying this
170,Aakash,29 October 2020,1.0 out of 5 stars,Bekaar. Its design is defective.,Useless toy. Very small.
171,Bharvi K Shandilya,5 July 2020,5.0 out of 5 stars,Oven toaster griller,Value for money
172,Amazon Customer,6 March 2021,3.0 out of 5 stars,Missing part,The separator grill is missing
173,Very nice,24 August 2020,1.0 out of 5 stars,No,No
174,Amit Singh,22 January 2021,5.0 out of 5 stars,Cast effective with best quality,"Good product as per my need., Excellent 👌"
175,jagtar singh,10 January 2021,5.0 out of 5 stars,Good product,"Delivered product in good condition.... Easy to operate.... Used for two days now with different stuff , working perfectly"
176,ranjan kumar,18 June 2020,5.0 out of 5 stars,Warranty issue,"Warranty card is neither fillup nor stamped,,, Cash memo also not provided..This is essential for warranty claims..."
177,Dronger,16 January 2021,5.0 out of 5 stars,As per image and brand proofe its quality,Nice
178,Simang Nunisa,19 December 2020,4.0 out of 5 stars,Oven Otg, Good producteasy to useThe product is finePacking also good 😃
179,sumit bhutani,26 September 2020,1.0 out of 5 stars,Think before buying this priduct,Waste of.money product.No taste in cooking in this...just show piece only at ur house
180,Harjinder,9 March 2021,5.0 out of 5 stars,Cook food while busy,Easy to use save time and energy. best for gym diet
181,Abhishek,7 August 2020,4.0 out of 5 stars,Inalsa Air Fryer- Excellent product!!!,Excellent product and Easy to use. First thing we made was potato fries. My 9 year old read the instructions and managed to make them on his own
182,Aamir Wani,24 January 2021,5.0 out of 5 stars,Great Product,A great product. Totally worth the price. Very easy to use - now I can enjoy oil free tasty food.
183,Srikanth reddy,29 September 2020,2.0 out of 5 stars,Nyg,Not a good producktDont buy if you want to bake an thing
184,Ruchika Kumar,19 July 2019,5.0 out of 5 stars,Very useful product,Very useful product. No frying but yet the taste is same. Crispy food.. Loved this product..
185,tanishk g.,16 July 2019,5.0 out of 5 stars,Good,"Very nice productLike it very much, food tastes great as if it’s really fried but without any oil. Easy to use and a must have for every household."
186,Sajeev,1 August 2020,5.0 out of 5 stars,It s awesomee,It's really amazing. I buyed my inalsa oven on the last month.I baked cake pizza sandwich and so on.worth of 💰 and I am really happy
187,Sk,2 November 2019,1.0 out of 5 stars,Not working product recieved too much fraud on amazon,Product is faulty and not working properly i am struggling with company and amazon to get it fix
188,Saurabh,9 April 2021,5.0 out of 5 stars,A must buy,Amazing product...absolutely value for money.. I am happy with the purchase.
189,Ankit,18 August 2020,1.0 out of 5 stars,Horrible experience,Never suggest anyone for this Air fryer food taste very bad and quality of this product also bad waste of money.
190,Kapil Sharma,10 August 2020,2.0 out of 5 stars,Faulty product,"it was broken , the handle was lose with no screw and it was opening without any manual efforts. It was free.."
191,Nitin,1 November 2020,4.0 out of 5 stars,Vfm and easy to use,Lovely. Vfm. Easy to use.Does the job perfectly.Recommended surely
192,Puneet,20 October 2020,5.0 out of 5 stars,Excellent and easy to use product,Very good and easy to use product. Rather an excellent product at this price. Nice cooked food without oil..
193,sahil,20 February 2021,5.0 out of 5 stars,Awsm product,Very nice product.....Please go for inalsa air fryer as compared to another brand.....
194,Anchal Garg,3 September 2020,2.0 out of 5 stars,Not good,It's of no use as it takes a lot of time to prepare the product. Electricity consumption is too high.
195,Khusi,4 September 2020,5.0 out of 5 stars,good product ..value for money,grt working product..easy to use ..perfect for baking ..roasting...toasting...perfect heating..cooks food in mins
196,Nimit Manglick,11 August 2020,3.0 out of 5 stars,Eject button was not working,"Nice product, now you can have your favorite mouth watering foods without any guilt.Very fast and convenient to use."
197,manisha,1 April 2021,4.0 out of 5 stars,Good product to purchase,This is easy to use and very good product to buy though cost wise a little expensive but it is OK.
198,kiran,27 March 2021,5.0 out of 5 stars,Used very little oil and fat,"Baked ,iced doughnuts. Batch of four doughnuts we're done in four minutes time. Excellent product."
199,Roko Kire Angami,30 October 2019,5.0 out of 5 stars,AWESOME,"I'M SO HAPPY WITH IT. GOT IT IN 2600 ( GREAT INDIA FESTIVAL) . DON'T LOOK FOR OTHER OTG, IF YOU ARE SEARCHING FOR LOW PRICE. GO FOR THIS.THANK YOU AMAZON AND INALSA"
200,Binu Varkey,30 October 2020,5.0 out of 5 stars,Best To Put in Use,A need for every home to improve health and reduce unwanted calories
201,AVira,26 March 2021,4.0 out of 5 stars,Good product,"After long use, its a good And stable product for every house hold."
202,dorababu,20 March 2021,3.0 out of 5 stars,Ok,Ok
203,prakash,12 January 2021,4.0 out of 5 stars,Happy !,Happy !!!
204,Vaibhav,3 November 2020,5.0 out of 5 stars,Awesome product,"Good quality product at reasonable price , the size is big and works well."
205,Makhhan Lal Talwar Singh,26 July 2020,1.0 out of 5 stars,Poor quality,"Button sticking,  not working properly,  dissatisfied"
206,Bolshi Shah,14 February 2021,5.0 out of 5 stars,Must buy,Awesome productMust buy for every household
207,DALVINDER S.,14 March 2021,5.0 out of 5 stars,Simply superb,Easy to use
208,Amazon Customer,1 November 2019,2.0 out of 5 stars,Poor paint quality,"The paint quality is very bad, it's started peeling off oyn three months, that to when it's very sparingly used. Needs definite improvement."
209,Utkarsh Gupta,24 May 2020,1.0 out of 5 stars,Improper heat quality,Food takes too much time to cook because of improper heat.Duo to autocut food doesn't get regular and continuous heat.
210,Rakesh Chand,25 October 2020,5.0 out of 5 stars,Superb product,"Good, rigid, economical and superb product. And its necessary home essential."
211,Varsha garg,24 October 2020,5.0 out of 5 stars,Amazing purchase,This product is super amazing and easy to use also besides cooking without oil it doesn't compromise in flavor
212,prabhakar singh,25 July 2019,1.0 out of 5 stars,Don't purchase anyone,Very bed experience I will sugges to go for other brand  this Brand heating problem front pannel not fit properly sensor issue Incloser issue totally wastage of money
213,Amazon Customer,12 November 2019,1.0 out of 5 stars,Worst product and customer service.,"Worst product.  From the day one it's not getting heated.  Made twice customer complaint,  till no action from them I wasted my money on this product."
214,Amazon Customer,9 August 2020,5.0 out of 5 stars,Great product,Have used for few months now. Great product and value for money.
215,NBBC,3 April 2021,5.0 out of 5 stars,Perfect,Awesome Product.
216,rajkumar sahu,3 December 2020,1.0 out of 5 stars,Not received full accessories kindly send or replace the item,We did not get 4 nos skewer rod and also not received wave wire grill rack and
217,Ramachandran Arimbathody,27 October 2020,4.0 out of 5 stars,Thumbs up couldn't ask for more at this price !,"Well, surely a buy primarily for those who is looking up to minimise the usage of oil related stuff"
218,ASHOK Bhatnagar,22 February 2020,1.0 out of 5 stars,Not able  to return this broken  piece,"Broken piece,  we were out of station  when we opened the package n checked, handle  is broken. Now the return window  was so short what to do."
219,Goutam Roy,22 May 2019,5.0 out of 5 stars,Inalsa is the best choice.,It's function is very effective.really it is value for money.
220,Sahil sisodia,6 February 2021,5.0 out of 5 stars,Loved the product,Loved the product! Super quick delivery and product is in a VERY good condition. Easy to use.
221,Hardik Bajaj,30 March 2021,5.0 out of 5 stars,INALSA Air Fryer,It is good for making oil free dishes and best for people who follow a strict diet..
222,mandeep,4 September 2020,5.0 out of 5 stars,original product,very good
223,Vaibhav Jain,26 October 2020,5.0 out of 5 stars,It is a very good and convenient device..,The Air fryer provides an easy and healthy way of preparing our favourite dishes..I loved it..
224,Emy S.,31 October 2020,1.0 out of 5 stars,Oven,Too small it's not useful for a house
225,Akshat  Omar,9 August 2020,4.0 out of 5 stars,Great 👌,Good product but it gets heated I mean u can't touch it by top or side tho good product
226,Alok Sikka,28 February 2021,3.0 out of 5 stars,Not that great so so product,"It takes time to cook in comparison to my old air fryer,"
227,Heeer Achpal,22 July 2020,1.0 out of 5 stars,Not worth buying,It's not worth buying this brand
228,Siddharth,25 August 2020,1.0 out of 5 stars,Seems risky,Smoke started coming once I turned it on which made me scared.The size of product is very small
229,Amazon Customer,4 March 2020,5.0 out of 5 stars,Good to buy this,Nice
230,Rajendra G Ladhe,25 March 2021,3.0 out of 5 stars,Good till now.,Today we recieved the fryer. Its getting switched on & displaying digital display.
231,Perpetina d.,30 October 2019,2.0 out of 5 stars,Inalsa oven,Dinner plate does not go in  outer  body becomes too hot  takes long time to become hot
232,Kirat,28 January 2021,5.0 out of 5 stars,Best product at this price,Nice product!Quite affordable!Prepare healthy food with less or no oil!
233,Mandar Chavan,27 October 2020,5.0 out of 5 stars,Usefull,Very good product very usefull
234,Dikshant,5 April 2021,4.0 out of 5 stars,Inalsa airfryer is a good buy,Overall a good product with temperature control and manual timer.
235,kiran sunny,13 June 2020,2.0 out of 5 stars,Unsatisfied product,The product item shown in the videos are not available and I'm very much unsatisfied with this product
236,Pandey ji,11 March 2020,3.0 out of 5 stars,Product is small,The product is too small is the big piece of product  plealse tell me i want bit electric tandoor plz help to satisfy me
237,Mohammed Ahmed,19 September 2020,5.0 out of 5 stars,Good,Good
238,Ira,17 March 2021,5.0 out of 5 stars,Amazing,It’s worth to buy. Happy to buy this product
239,Meghna,12 August 2020,5.0 out of 5 stars,Good product,Very nice product. Value for money.
240,Manish,7 August 2020,5.0 out of 5 stars,Very efficient product,Am very satisfied with the product. Easy to use and handle even by kids. Use it almost daily.
241,Bhupinder ,7 September 2020,3.0 out of 5 stars,Average product depends on pocket.,Screw out of body.Small dent on body.Average quality.
242,Sankalp Mathur,22 September 2020,4.0 out of 5 stars,Fit and finish not upto the mark,"Overall a good product. However, fit and finish of the mating parts needs improvement."
243,Nageswararaoboddupalli,15 January 2021,1.0 out of 5 stars,Bad,It is very bad quality  I lost my money. It's  not working  offter one month .
244,sania,4 April 2021,5.0 out of 5 stars,Very nice product,"Less use of oil,fast cooking and easy to operate.Overall nice product."
245,Mohamed Ilyas,10 August 2020,5.0 out of 5 stars,Good,Like the product..worth of money
